{"schema_version":2,"product":"wokcore","api_major":1,"version":"1.2.3","signing_key_id":"E8A6D79D6B0D7E47","artifacts":[{"target":"x86_64-pc-windows-msvc","file":"WokCore-v1.2.3-Windows-x86_64-Portable.zip","executable":"wokcore.exe","size":47,"sha256":"1b6d5e41a0e4a2b9de148b8553f9fb43b3160dd7988b6d3d41e9f9a0b7bebd04","url":"https://github.com/hongjiadev/wokcore/releases/download/v1.2.3/WokCore-v1.2.3-Windows-x86_64-Portable.zip"},{"target":"aarch64-pc-windows-msvc","file":"WokCore-v1.2.3-Windows-arm64-Portable.zip","executable":"wokcore.exe","size":46,"sha256":"a870adaf84dc72f0cf4810730dcbac902c5cc303e07147a91ab8deaf2412c02e","url":"https://github.com/hongjiadev/wokcore/releases/download/v1.2.3/WokCore-v1.2.3-Windows-arm64-Portable.zip"},{"target":"x86_64-apple-darwin","file":"WokCore-v1.2.3-macOS-x86_64.tar.gz","executable":"wokcore","size":39,"sha256":"af7e8e9555e0ca7fc2215fad060c3ff945467d6d4ad223d7fa88d9bf5f615e2a","url":"https://github.com/hongjiadev/wokcore/releases/download/v1.2.3/WokCore-v1.2.3-macOS-x86_64.tar.gz"},{"target":"aarch64-apple-darwin","file":"WokCore-v1.2.3-macOS-arm64.tar.gz","executable":"wokcore","size":38,"sha256":"ead762da172d5772e1570c1c52da06f2b8b8cdba3e924983105cf11d41cd34bb","url":"https://github.com/hongjiadev/wokcore/releases/download/v1.2.3/WokCore-v1.2.3-macOS-arm64.tar.gz"},{"target":"x86_64-unknown-linux-gnu","file":"WokCore-v1.2.3-Linux-x86_64.tar.gz","executable":"wokcore","size":39,"sha256":"2cc5dae5cee3f7f53ca0610b3e0cc42b84b0275ca2d70c0b8d9e0b3ee7b06fcf","url":"https://github.com/hongjiadev/wokcore/releases/download/v1.2.3/WokCore-v1.2.3-Linux-x86_64.tar.gz"},{"target":"aarch64-unknown-linux-gnu","file":"WokCore-v1.2.3-Linux-arm64.tar.gz","executable":"wokcore","size":38,"sha256":"bed81b24546099863104e90d077a156c8acddd1d850e4b95e0c770bac4f3ae41","url":"https://github.com/hongjiadev/wokcore/releases/download/v1.2.3/WokCore-v1.2.3-Linux-arm64.tar.gz"}]}
